"No.","Time","Source","Destination","Protocol","Length","Info"
"1","0.000000","131.243.155.250","128.3.161.46","TCP","62","nicelink > printer-agent [SYN] Seq=0 Win=8192 Len=0 MSS=1460 SACK_PERM=1"
"2","0.000327","128.3.161.46","131.243.155.250","TCP","62","printer-agent > nicelink [SYN, ACK] Seq=0 Ack=1 Win=6144 Len=0 MSS=1380 SACK_PERM=1"
"3","0.000623","131.243.155.250","128.3.161.46","TCP","60","nicelink > printer-agent [ACK] Seq=1 Ack=1 Win=8280 Len=0"
"4","0.001122","131.243.155.250","128.3.161.46","TCP","246","nicelink > printer-agent [PSH, ACK] Seq=1 Ack=1 Win=8280 Len=192"
"5","0.001447","128.3.161.46","131.243.155.250","TCP","60","printer-agent > nicelink [ACK] Seq=1 Ack=193 Win=7524 Len=0"
"6","0.001697","128.3.161.46","131.243.155.250","TCP","138","printer-agent > nicelink [PSH, ACK] Seq=1 Ack=193 Win=7524 Len=84"
"7","0.002371","131.243.155.250","128.3.161.46","TCP","274","nicelink > printer-agent [PSH, ACK] Seq=193 Ack=85 Win=8196 Len=220"
"8","0.003071","128.3.161.46","131.243.155.250","TCP","298","printer-agent > nicelink [PSH, ACK] Seq=85 Ack=413 Win=7304 Len=244"
"9","0.004120","131.243.155.250","128.3.161.46","TCP","102","nicelink > printer-agent [PSH, ACK] Seq=413 Ack=329 Win=7952 Len=48"
"10","0.004449","128.3.161.46","131.243.155.250","TCP","86","printer-agent > nicelink [PSH, ACK] Seq=329 Ack=461 Win=7256 Len=32"
"11","0.004997","131.243.155.250","128.3.161.46","TCP","60","nicelink > printer-agent [FIN, ACK] Seq=461 Ack=361 Win=7920 Len=0"
"12","0.005201","128.3.161.46","131.243.155.250","TCP","60","printer-agent > nicelink [ACK] Seq=361 Ack=462 Win=7255 Len=0"
"13","0.005212","128.3.161.46","131.243.155.250","TCP","60","printer-agent > nicelink [FIN, PSH, ACK] Seq=361 Ack=462 Win=7255 Len=0"
"14","0.005619","131.243.155.250","128.3.161.46","TCP","62","cnrprotocol > printer-agent [SYN] Seq=0 Win=8192 Len=0 MSS=1460 SACK_PERM=1"
"15","0.005625","131.243.155.250","128.3.161.46","TCP","60","nicelink > printer-agent [ACK] Seq=462 Ack=362 Win=7920 Len=0"
"16","0.006195","128.3.161.46","131.243.155.250","TCP","62","printer-agent > cnrprotocol [SYN, ACK] Seq=0 Ack=1 Win=6144 Len=0 MSS=1380 SACK_PERM=1"
"17","0.006494","131.243.155.250","128.3.161.46","TCP","60","cnrprotocol > printer-agent [ACK] Seq=1 Ack=1 Win=8280 Len=0"
"18","0.007118","131.243.155.250","128.3.161.46","TCP","162","cnrprotocol > printer-agent [PSH, ACK] Seq=1 Ack=1 Win=8280 Len=108"
"19","0.007444","128.3.161.46","131.243.155.250","TCP","60","printer-agent > cnrprotocol [ACK] Seq=1 Ack=109 Win=7524 Len=0"
"20","0.007569","128.3.161.46","131.243.155.250","TCP","130","printer-agent > cnrprotocol [PSH, ACK] Seq=1 Ack=109 Win=7524 Len=76"
"21","0.009616","131.243.155.250","128.3.161.46","TCP","266","cnrprotocol > printer-agent [PSH, ACK] Seq=109 Ack=77 Win=8204 Len=212"
"22","0.010696","128.3.161.46","131.243.155.250","TCP","290","printer-agent > cnrprotocol [PSH, ACK] Seq=77 Ack=321 Win=7312 Len=236"
"23","0.011497","131.243.155.250","128.3.161.46","TCP","102","cnrprotocol > printer-agent [PSH, ACK] Seq=321 Ack=313 Win=7968 Len=48"
"24","0.011816","128.3.161.46","131.243.155.250","TCP","86","printer-agent > cnrprotocol [PSH, ACK] Seq=313 Ack=369 Win=7264 Len=32"
"25","0.012864","131.243.155.250","128.3.161.46","TCP","60","cnrprotocol > printer-agent [FIN, ACK] Seq=369 Ack=345 Win=7936 Len=0"
"26","0.013066","128.3.161.46","131.243.155.250","TCP","60","printer-agent > cnrprotocol [ACK] Seq=345 Ack=370 Win=7263 Len=0"
"27","0.013071","128.3.161.46","131.243.155.250","TCP","60","printer-agent > cnrprotocol [FIN, PSH, ACK] Seq=345 Ack=370 Win=7263 Len=0"
"28","0.013365","131.243.155.250","128.3.161.46","TCP","60","cnrprotocol > printer-agent [ACK] Seq=370 Ack=346 Win=7936 Len=0"
"29","0.048546","131.243.103.13","239.255.255.253","SRVLOC","91","[Packet size limited during capture]"
"30","0.654927","131.243.105.204","239.255.255.253","SRVLOC","91","[Packet size limited during capture]"
"31","0.734877","131.243.127.24","239.255.255.253","SRVLOC","91","[Packet size limited during capture]"
"32","0.869042","131.243.127.24","239.255.255.253","SRVLOC","91","[Packet size limited during capture]"
"33","1.165861","131.243.94.195","239.255.255.253","SRVLOC","91","[Packet size limited during capture]"
"34","1.278668","128.3.161.74","131.243.155.146","TCP","60","ncp > nsstp [ACK] Seq=1 Ack=1 Win=8904 Len=1"
"35","1.278968","131.243.155.146","128.3.161.74","TCP","60","nsstp > ncp [ACK] Seq=1 Ack=2 Win=16290 Len=0"
"36","1.318268","131.243.61.70","239.255.255.253","SRVLOC","91","[Packet size limited during capture]"
"37","2.594862","80:0b:98:3b:b9:ec","27:36:8c:ff:ff:ff","LLC","393","[Packet size limited during capture]"
"38","2.696802","131.243.61.187","239.255.255.253","SRVLOC","91","[Packet size limited during capture]"
"39","2.863573","128.3.164.191","131.243.155.113","TCP","60","unieng > oc-lm [PSH, ACK] Seq=1 Ack=1 Win=31740 Len=1"
"40","2.863873","131.243.155.113","128.3.164.191","TCP","60","oc-lm > unieng [ACK] Seq=1 Ack=2 Win=29585 Len=0"
"41","3.301806","131.243.103.13","239.255.255.253","SRVLOC","91","[Packet size limited during capture]"
"42","3.410885","128.3.255.34","224.0.1.22","SRVLOC","128","[Packet size limited during capture]"
"43","3.411253","128.3.255.34","224.0.1.22","SRVLOC","184","[Packet size limited during capture]"
"44","3.500365","44:39:9e:a2:df:23","Broadcast","IPX","94","[Packet size limited during capture]"
"45","3.501483","131.243.155.83","131.243.155.255","NBDS","274","[Packet size limited during capture]"
"46","3.502482","82:95:f4:2b:95:3d","Broadcast","IPX","94","[Packet size limited during capture]"
"47","3.731168","80:0b:98:3b:b9:ec","Broadcast","IPX","494","[Packet size limited during capture]"
"48","3.734915","131.243.127.24","239.255.255.253","SRVLOC","91","[Packet size limited during capture]"
"49","3.744216","02:c3:ab:be:6f:a9","Broadcast","ARP","60","Who has 131.243.155.227?  Tell 131.243.155.125"
"50","3.787134","80:0b:98:3b:b9:ec","Broadcast","IPX","494","[Packet size limited during capture]"
"51","3.843230","80:0b:98:3b:b9:ec","Broadcast","IPX","494","[Packet size limited during capture]"
"52","3.899189","80:0b:98:3b:b9:ec","Broadcast","IPX","494","[Packet size limited during capture]"
"53","3.955156","80:0b:98:3b:b9:ec","Broadcast","IPX","494","[Packet size limited during capture]"
"54","3.966527","131.243.105.204","239.255.255.253","SRVLOC","91","[Packet size limited during capture]"
"55","4.011247","80:0b:98:3b:b9:ec","Broadcast","IPX","494","[Packet size limited during capture]"
"56","4.067213","80:0b:98:3b:b9:ec","Broadcast","IPX","494","[Packet size limited during capture]"
"57","4.123185","80:0b:98:3b:b9:ec","Broadcast","IPX","494","[Packet size limited during capture]"
"58","4.169400","131.243.94.195","239.255.255.253","SRVLOC","91","[Packet size limited during capture]"
"59","4.179144","80:0b:98:3b:b9:ec","Broadcast","IPX","494","[Packet size limited during capture]"
"60","4.235235","80:0b:98:3b:b9:ec","Broadcast","IPX","494","[Packet size limited during capture]"
"61","4.281756","82:95:f4:2b:95:3d","Broadcast","IPX","94","[Packet size limited during capture]"
"62","4.291200","80:0b:98:3b:b9:ec","Broadcast","IPX","494","[Packet size limited during capture]"
"63","4.318558","131.243.61.70","239.255.255.253","SRVLOC","91","[Packet size limited during capture]"
"64","4.347171","80:0b:98:3b:b9:ec","Broadcast","IPX","494","[Packet size limited during capture]"
"65","4.389267","128.3.255.34","224.0.1.22","SRVLOC","128","[Packet size limited during capture]"
"66","4.389390","128.3.255.34","224.0.1.22","SRVLOC","184","[Packet size limited during capture]"
"67","4.403132","80:0b:98:3b:b9:ec","Broadcast","IPX","494","[Packet size limited during capture]"
"68","4.459223","80:0b:98:3b:b9:ec","Broadcast","IPX","494","[Packet size limited during capture]"
"69","4.515189","80:0b:98:3b:b9:ec","Broadcast","IPX","494","[Packet size limited during capture]"
"70","4.580399","80:0b:98:3b:b9:ec","Broadcast","IPX","494","[Packet size limited during capture]"
"71","4.635115","80:0b:98:3b:b9:ec","Broadcast","IPX","494","[Packet size limited during capture]"
"72","4.691206","80:0b:98:3b:b9:ec","Broadcast","IPX","494","[Packet size limited during capture]"
"73","4.747176","80:0b:98:3b:b9:ec","Broadcast","IPX","494","[Packet size limited during capture]"
"74","4.803137","80:0b:98:3b:b9:ec","Broadcast","IPX","494","[Packet size limited during capture]"
"75","4.859228","80:0b:98:3b:b9:ec","Broadcast","IPX","494","[Packet size limited during capture]"
"76","4.915195","80:0b:98:3b:b9:ec","Broadcast","IPX","494","[Packet size limited during capture]"
"77","4.971160","80:0b:98:3b:b9:ec","Broadcast","IPX","494","[Packet size limited during capture]"
"78","4.986410","131.243.140.151","224.0.1.22","SRVLOC","146","[Packet size limited during capture]"
"79","5.027252","80:0b:98:3b:b9:ec","Broadcast","IPX","494","[Packet size limited during capture]"
"80","5.061031","82:95:f4:2b:95:3d","Broadcast","IPX","94","[Packet size limited during capture]"
"81","5.083343","80:0b:98:3b:b9:ec","Broadcast","IPX","494","[Packet size limited during capture]"
"82","5.123073","80:0b:98:3b:b9:ec","44:39:9e:a2:df:23","IPX","60","[Packet size limited during capture]"
"83","5.123370","44:39:9e:a2:df:23","80:0b:98:3b:b9:ec","IPX","60","[Packet size limited during capture]"
"84","5.139182","80:0b:98:3b:b9:ec","Broadcast","IPX","494","[Packet size limited during capture]"
"85","5.171094","44:39:9e:bb:e6:b1","80:0b:98:3b:b9:ec","IPX","60","[Packet size limited during capture]"
"86","5.173911","80:0b:98:3b:b9:ec","44:39:9e:bb:e6:b1","IPX","60","[Packet size limited during capture]"
"87","5.195149","80:0b:98:3b:b9:ec","Broadcast","IPX","494","[Packet size limited during capture]"
"88","5.251120","80:0b:98:3b:b9:ec","Broadcast","IPX","494","[Packet size limited during capture]"
"89","5.307210","80:0b:98:3b:b9:ec","Broadcast","IPX","494","[Packet size limited during capture]"
"90","5.363171","80:0b:98:3b:b9:ec","Broadcast","IPX","494","[Packet size limited during capture]"
"91","5.390153","128.3.255.34","224.0.1.22","SRVLOC","128","[Packet size limited during capture]"
"92","5.390403","128.3.255.34","224.0.1.22","SRVLOC","184","[Packet size limited during capture]"
"93","5.410891","128.3.255.34","224.0.1.22","SRVLOC","103","[Packet size limited during capture]"
"94","5.411016","128.3.255.34","224.0.1.22","SRVLOC","134","[Packet size limited during capture]"
"95","5.419261","80:0b:98:3b:b9:ec","Broadcast","IPX","494","[Packet size limited during capture]"
"96","5.475226","80:0b:98:3b:b9:ec","Broadcast","IPX","494","[Packet size limited during capture]"
"97","5.531192","80:0b:98:3b:b9:ec","Broadcast","IPX","494","[Packet size limited during capture]"
"98","5.587158","80:0b:98:3b:b9:ec","Broadcast","IPX","494","[Packet size limited during capture]"
"99","5.643125","80:0b:98:3b:b9:ec","Broadcast","IPX","494","[Packet size limited during capture]"
"100","5.696842","131.243.61.187","239.255.255.253","SRVLOC","91","[Packet size limited during capture]"
"101","5.699214","80:0b:98:3b:b9:ec","Broadcast","IPX","494","[Packet size limited during capture]"
"102","5.755185","80:0b:98:3b:b9:ec","Broadcast","IPX","494","[Packet size limited during capture]"
"103","5.774095","131.243.155.250","208.189.202.205","TCP","62","sunclustermgr > http [SYN] Seq=0 Win=8192 Len=0 MSS=1460 SACK_PERM=1"
"104","5.777667","208.189.202.205","131.243.155.250","TCP","62","http > sunclustermgr [SYN, ACK] Seq=0 Ack=1 Win=5840 Len=0 MSS=1380 SACK_PERM=1"
"105","5.777966","131.243.155.250","208.189.202.205","TCP","60","sunclustermgr > http [ACK] Seq=1 Ack=1 Win=8280 Len=0"
"106","5.811146","80:0b:98:3b:b9:ec","Broadcast","IPX","494","[Packet size limited during capture]"
"107","5.812695","131.243.155.250","208.189.202.205","TCP","1434","sunclustermgr > http [ACK] Seq=1 Ack=1 Win=8280 Len=1380"
"108","5.813444","131.243.155.250","208.189.202.205","TCP","672","sunclustermgr > http [PSH, ACK] Seq=1381 Ack=1 Win=8280 Len=618"
"109","5.817143","208.189.202.205","131.243.155.250","TCP","60","http > sunclustermgr [ACK] Seq=1 Ack=1381 Win=8280 Len=0"
"110","5.817393","208.189.202.205","131.243.155.250","TCP","60","http > sunclustermgr [ACK] Seq=1 Ack=1999 Win=11040 Len=0"
"111","5.818142","208.189.202.205","131.243.155.250","TCP","60","[TCP Previous segment not captured] http > sunclustermgr [FIN, ACK] Seq=740 Ack=1999 Win=11040 Len=0"
"112","5.818267","208.189.202.205","131.243.155.250","TCP","793","[TCP Out-Of-Order] http > sunclustermgr [PSH, ACK] Seq=1 Ack=1999 Win=11040 Len=739"
"113","5.819066","131.243.155.250","208.189.202.205","TCP","66","[TCP Dup ACK 108#1] sunclustermgr > http [ACK] Seq=1999 Ack=1 Win=8280 Len=0 SLE=740 SRE=741"
"114","5.819815","131.243.155.250","208.189.202.205","TCP","66","sunclustermgr > http [ACK] Seq=1999 Ack=741 Win=7541 Len=0 SLE=740 SRE=741"
"115","5.835431","131.243.155.250","208.189.202.205","TCP","60","sunclustermgr > http [FIN, ACK] Seq=1999 Ack=741 Win=7541 Len=0"
"116","5.839508","208.189.202.205","131.243.155.250","TCP","60","http > sunclustermgr [ACK] Seq=741 Ack=2000 Win=11040 Len=0"
"117","5.840678","82:95:f4:2b:95:3d","Broadcast","IPX","262","[Packet size limited during capture]"
"118","5.841177","131.243.155.83","131.243.155.255","NBDS","274","[Packet size limited during capture]"
"119","5.841302","82:95:f4:2b:95:3d","Broadcast","IPX","262","[Packet size limited during capture]"
"120","5.867112","80:0b:98:3b:b9:ec","Broadcast","IPX","494","[Packet size limited during capture]"
"121","5.889724","131.243.140.151","224.0.1.22","SRVLOC","130","[Packet size limited during capture]"
"122","5.923459","80:0b:98:3b:b9:ec","Broadcast","IPX","494","[Packet size limited during capture]"
"123","5.979174","80:0b:98:3b:b9:ec","Broadcast","IPX","494","[Packet size limited during capture]"
"124","6.035136","80:0b:98:3b:b9:ec","Broadcast","IPX","494","[Packet size limited during capture]"
"125","6.074286","131.243.155.250","208.189.202.205","TCP","62","rmiactivation > http [SYN] Seq=0 Win=8192 Len=0 MSS=1460 SACK_PERM=1"
"126","6.078233","208.189.202.205","131.243.155.250","TCP","62","http > rmiactivation [SYN, ACK] Seq=0 Ack=1 Win=5840 Len=0 MSS=1380 SACK_PERM=1"
"127","6.078537","131.243.155.250","208.189.202.205","TCP","60","rmiactivation > http [ACK] Seq=1 Ack=1 Win=8280 Len=0"
"128","6.091104","80:0b:98:3b:b9:ec","Broadcast","IPX","494","[Packet size limited during capture]"
"129","6.099401","131.243.155.250","208.189.202.205","TCP","1434","rmiactivation > http [ACK] Seq=1 Ack=1 Win=8280 Len=1380"
"130","6.099651","131.243.155.250","208.189.202.205","TCP","536","rmiactivation > http [PSH, ACK] Seq=1381 Ack=1 Win=8280 Len=482"
"131","6.103843","208.189.202.205","131.243.155.250","TCP","60","http > rmiactivation [ACK] Seq=1 Ack=1381 Win=8280 Len=0"
"132","6.103967","208.189.202.205","131.243.155.250","TCP","60","http > rmiactivation [ACK] Seq=1 Ack=1863 Win=11040 Len=0"
"133","6.104841","208.189.202.205","131.243.155.250","TCP","797","http > rmiactivation [PSH, ACK] Seq=1 Ack=1863 Win=11040 Len=743"
"134","6.104848","208.189.202.205","131.243.155.250","TCP","60","http > rmiactivation [FIN, ACK] Seq=744 Ack=1863 Win=11040 Len=0"
"135","6.107139","131.243.155.250","208.189.202.205","TCP","60","rmiactivation > http [ACK] Seq=1863 Ack=745 Win=7537 Len=0"
"136","6.124255","131.243.155.250","208.189.202.205","TCP","60","rmiactivation > http [FIN, ACK] Seq=1863 Ack=745 Win=7537 Len=0"
"137","6.127953","208.189.202.205","131.243.155.250","TCP","60","http > rmiactivation [ACK] Seq=745 Ack=1864 Win=11040 Len=0"
"138","6.147191","80:0b:98:3b:b9:ec","Broadcast","IPX","494","[Packet size limited during capture]"
"139","6.203158","80:0b:98:3b:b9:ec","Broadcast","IPX","494","[Packet size limited during capture]"
"140","6.259122","80:0b:98:3b:b9:ec","Broadcast","IPX","494","[Packet size limited during capture]"
"141","6.301228","131.243.103.13","239.255.255.253","SRVLOC","91","[Packet size limited during capture]"
"142","6.315213","80:0b:98:3b:b9:ec","Broadcast","IPX","494","[Packet size limited during capture]"
"143","6.324259","2e:9f:6e:9b:93:77","Broadcast","LLC","60","[Packet size limited during capture]"
"144","6.324383","2e:9f:6e:9b:93:77","Broadcast","LLC","60","[Packet size limited during capture]"
"145","6.324507","2e:9f:6e:9b:93:77","Broadcast","IPX","60","[Packet size limited during capture]"
"146","6.324632","2e:9f:6e:9b:93:77","Broadcast","LLC","60","[Packet size limited during capture]"
"147","6.331958","80:0b:98:3b:b9:ec","2e:9f:6e:9b:93:77","IPX","302","[Packet size limited during capture]"
"148","6.371180","80:0b:98:3b:b9:ec","Broadcast","IPX","494","[Packet size limited during capture]"
"149","6.391166","128.3.255.34","224.0.1.22","SRVLOC","103","[Packet size limited during capture]"
"150","6.391416","128.3.255.34","224.0.1.22","SRVLOC","134","[Packet size limited during capture]"
"151","6.427145","80:0b:98:3b:b9:ec","Broadcast","IPX","494","[Packet size limited during capture]"
"152","6.483237","80:0b:98:3b:b9:ec","Broadcast","IPX","494","[Packet size limited during capture]"
"153","6.502773","131.243.155.83","131.243.155.255","NBDS","274","[Packet size limited during capture]"
"154","6.503023","82:95:f4:2b:95:3d","Broadcast","IPX","262","[Packet size limited during capture]"
"155","6.539208","80:0b:98:3b:b9:ec","Broadcast","IPX","494","[Packet size limited during capture]"
"156","6.595168","80:0b:98:3b:b9:ec","Broadcast","IPX","494","[Packet size limited during capture]"
"157","6.651133","80:0b:98:3b:b9:ec","Broadcast","IPX","494","[Packet size limited during capture]"
"158","6.679866","128.3.209.68","239.255.255.253","SRVLOC","91","[Packet size limited during capture]"
"159","6.707098","80:0b:98:3b:b9:ec","Broadcast","IPX","494","[Packet size limited during capture]"
"160","6.763196","80:0b:98:3b:b9:ec","Broadcast","IPX","494","[Packet size limited during capture]"
"161","6.819284","80:0b:98:3b:b9:ec","Broadcast","IPX","494","[Packet size limited during capture]"
"162","6.875121","80:0b:98:3b:b9:ec","Broadcast","IPX","494","[Packet size limited during capture]"
"163","6.890612","131.243.140.151","224.0.1.22","SRVLOC","168","[Packet size limited during capture]"
"164","6.931087","80:0b:98:3b:b9:ec","Broadcast","IPX","494","[Packet size limited during capture]"
"165","6.982856","131.243.155.250","218.131.115.53","TCP","60","netarx > http [FIN, ACK] Seq=1 Ack=1 Win=8760 Len=0"
"166","6.982979","131.243.155.250","218.131.115.51","TCP","60","ansoft-lm-2 > http [FIN, ACK] Seq=1 Ack=1 Win=8760 Len=0"
"167","6.985429","218.131.115.51","131.243.155.250","TCP","60","http > ansoft-lm-2 [FIN, ACK] Seq=1 Ack=2 Win=6432 Len=0"
"168","6.985728","131.243.155.250","218.131.115.51","TCP","60","ansoft-lm-2 > http [ACK] Seq=2 Ack=2 Win=8760 Len=0"
"169","6.987677","80:0b:98:3b:b9:ec","Broadcast","IPX","494","[Packet size limited during capture]"
"170","7.024531","218.131.115.53","131.243.155.250","TCP","60","http > netarx [ACK] Seq=1 Ack=2 Win=33228 Len=0"
"171","7.026779","218.131.115.53","131.243.155.250","TCP","60","http > netarx [FIN, ACK] Seq=1 Ack=2 Win=33228 Len=0"
"172","7.027078","131.243.155.250","218.131.115.53","TCP","60","netarx > http [ACK] Seq=2 Ack=2 Win=8760 Len=0"
"173","7.043143","80:0b:98:3b:b9:ec","Broadcast","IPX","494","[Packet size limited during capture]"
"174","7.099109","80:0b:98:3b:b9:ec","Broadcast","IPX","494","[Packet size limited during capture]"
"175","7.155076","80:0b:98:3b:b9:ec","Broadcast","IPX","494","[Packet size limited during capture]"
"176","7.169940","131.243.94.195","239.255.255.253","SRVLOC","91","[Packet size limited during capture]"
"177","7.211166","80:0b:98:3b:b9:ec","Broadcast","IPX","494","[Packet size limited during capture]"
"178","7.267138","80:0b:98:3b:b9:ec","Broadcast","IPX","494","[Packet size limited during capture]"
"179","7.321224","131.243.61.70","239.255.255.253","SRVLOC","91","[Packet size limited during capture]"
"180","7.323103","80:0b:98:3b:b9:ec","Broadcast","IPX","494","[Packet size limited during capture]"
"181","7.379188","80:0b:98:3b:b9:ec","Broadcast","IPX","494","[Packet size limited during capture]"
"182","7.392061","128.3.255.34","224.0.1.22","SRVLOC","103","[Packet size limited during capture]"
"183","7.392435","128.3.255.34","224.0.1.22","SRVLOC","134","[Packet size limited during capture]"
"184","7.435153","80:0b:98:3b:b9:ec","Broadcast","IPX","494","[Packet size limited during capture]"
"185","7.489496","131.243.105.204","239.255.255.253","SRVLOC","91","[Packet size limited during capture]"
"186","7.491119","80:0b:98:3b:b9:ec","Broadcast","IPX","494","[Packet size limited during capture]"
"187","7.547089","80:0b:98:3b:b9:ec","Broadcast","IPX","494","[Packet size limited during capture]"
"188","7.603182","80:0b:98:3b:b9:ec","Broadcast","IPX","494","[Packet size limited during capture]"
"189","7.659142","80:0b:98:3b:b9:ec","Broadcast","IPX","494","[Packet size limited during capture]"
"190","7.715482","80:0b:98:3b:b9:ec","Broadcast","IPX","494","[Packet size limited during capture]"
"191","7.771199","80:0b:98:3b:b9:ec","Broadcast","IPX","494","[Packet size limited during capture]"
"192","7.827164","80:0b:98:3b:b9:ec","Broadcast","IPX","494","[Packet size limited during capture]"
"193","7.883257","80:0b:98:3b:b9:ec","Broadcast","IPX","494","[Packet size limited during capture]"
"194","7.942594","80:0b:98:3b:b9:ec","Broadcast","IPX","494","[Packet size limited during capture]"
"195","7.986568","131.243.140.151","224.0.1.22","SRVLOC","150","[Packet size limited during capture]"
"196","7.995187","80:0b:98:3b:b9:ec","Broadcast","IPX","494","[Packet size limited during capture]"
"197","8.003612","131.243.155.83","131.243.155.255","NBDS","274","[Packet size limited during capture]"
"198","8.003859","82:95:f4:2b:95:3d","Broadcast","IPX","262","[Packet size limited during capture]"
"199","8.051152","80:0b:98:3b:b9:ec","Broadcast","IPX","494","[Packet size limited during capture]"
"200","8.107122","80:0b:98:3b:b9:ec","Broadcast","IPX","494","[Packet size limited during capture]"
"201","8.163085","80:0b:98:3b:b9:ec","Broadcast","IPX","494","[Packet size limited during capture]"
"202","8.219175","80:0b:98:3b:b9:ec","Broadcast","IPX","494","[Packet size limited during capture]"
"203","8.275146","80:0b:98:3b:b9:ec","Broadcast","IPX","494","[Packet size limited during capture]"
"204","8.331106","80:0b:98:3b:b9:ec","Broadcast","IPX","494","[Packet size limited during capture]"
"205","8.348845","128.3.161.22","131.243.155.227","UDP","87","Source port: 1032  Destination port: snmp[Packet size limited during capture]"
"206","8.387072","80:0b:98:3b:b9:ec","Broadcast","IPX","494","[Packet size limited during capture]"
"207","8.443170","80:0b:98:3b:b9:ec","Broadcast","IPX","494","[Packet size limited during capture]"
"208","8.465075","131.243.155.227","128.3.161.22","UDP","89","Source port: snmp  Destination port: 1032[Packet size limited during capture]"
"209","8.499128","80:0b:98:3b:b9:ec","Broadcast","IPX","494","[Packet size limited during capture]"
"210","8.555095","80:0b:98:3b:b9:ec","Broadcast","IPX","494","[Packet size limited during capture]"
"211","8.611060","80:0b:98:3b:b9:ec","Broadcast","IPX","494","[Packet size limited during capture]"
"212","8.667151","80:0b:98:3b:b9:ec","Broadcast","IPX","494","[Packet size limited during capture]"
"213","8.696758","131.243.61.187","239.255.255.253","SRVLOC","91","[Packet size limited during capture]"
"214","8.700506","128.3.161.22","131.243.155.227","UDP","87","Source port: 1032  Destination port: snmp[Packet size limited during capture]"
"215","8.708126","131.243.140.213","224.0.1.22","SRVLOC","216","[Packet size limited during capture]"
"216","8.723117","80:0b:98:3b:b9:ec","Broadcast","IPX","110","[Packet size limited during capture]"
"217","8.860465","131.243.155.227","128.3.161.22","UDP","89","Source port: snmp  Destination port: 1032[Packet size limited during capture]"
"218","8.883769","128.3.161.22","131.243.155.227","UDP","87","Source port: 1032  Destination port: snmp[Packet size limited during capture]"
"219","8.893263","131.243.140.151","224.0.1.22","SRVLOC","150","[Packet size limited during capture]"
"220","8.972389","131.243.155.227","128.3.161.22","UDP","89","Source port: snmp  Destination port: 1032[Packet size limited during capture]"
"221","8.981584","128.3.161.22","131.243.155.227","UDP","87","Source port: 1032  Destination port: snmp[Packet size limited during capture]"
"222","9.076402","128.3.161.22","131.243.155.227","TCP","60","893 > printer [FIN, PSH, ACK] Seq=1 Ack=1 Win=6144 Len=0"
"223","9.079824","131.243.155.227","128.3.161.22","TCP","60","printer > 893 [ACK] Seq=1 Ack=2 Win=5824 Len=0"
"224","9.081198","131.243.155.250","193.116.32.109","TCP","62","rmiregistry > http [SYN] Seq=0 Win=8192 Len=0 MSS=1460 SACK_PERM=1"
"225","9.087694","131.243.155.227","128.3.161.22","TCP","60","printer > 893 [FIN, ACK] Seq=1 Ack=2 Win=5824 Len=0"
"226","9.088018","128.3.161.22","131.243.155.227","TCP","60","893 > printer [ACK] Seq=2 Ack=2 Win=6143 Len=0"
"227","9.168970","193.116.32.109","131.243.155.250","TCP","62","http > rmiregistry [SYN, ACK] Seq=0 Ack=1 Win=64240 Len=0 SACK_PERM=1 MSS=1460"
"228","9.169269","131.243.155.250","193.116.32.109","TCP","60","rmiregistry > http [ACK] Seq=1 Ack=1 Win=8760 Len=0"
"229","9.170892","131.243.155.250","193.116.32.109","TCP","1339","rmiregistry > http [PSH, ACK] Seq=1 Ack=1 Win=8760 Len=1285"
"230","9.228607","131.243.155.227","128.3.161.22","UDP","103","Source port: snmp  Destination port: 1032[Packet size limited during capture]"
"231","9.258165","193.116.32.109","131.243.155.250","TCP","60","http > rmiregistry [ACK] Seq=1 Ack=1286 Win=64240 Len=0"
"232","9.269658","128.3.161.22","131.243.155.227","UDP","89","Source port: 1032  Destination port: snmp[Packet size limited during capture]"
"233","9.276406","193.116.32.109","131.243.155.250","TCP","1514","http > rmiregistry [ACK] Seq=1 Ack=1286 Win=64240 Len=1460"
"234","9.276657","193.116.32.109","131.243.155.250","TCP","1514","http > rmiregistry [PSH, ACK] Seq=1461 Ack=1286 Win=64240 Len=1460"
"235","9.279201","131.243.155.250","193.116.32.109","TCP","60","rmiregistry > http [ACK] Seq=1286 Ack=2921 Win=8760 Len=0"
"236","9.301013","131.243.103.13","239.255.255.253","SRVLOC","91","[Packet size limited during capture]"
"237","9.366599","193.116.32.109","131.243.155.250","TCP","1514","http > rmiregistry [ACK] Seq=2921 Ack=1286 Win=64240 Len=1460"
"238","9.366849","193.116.32.109","131.243.155.250","TCP","1514","http > rmiregistry [ACK] Seq=4381 Ack=1286 Win=64240 Len=1460"
"239","9.366974","193.116.32.109","131.243.155.250","TCP","1514","http > rmiregistry [PSH, ACK] Seq=5841 Ack=1286 Win=64240 Len=1460"
"240","9.370521","131.243.155.250","193.116.32.109","TCP","60","rmiregistry > http [ACK] Seq=1286 Ack=5841 Win=8760 Len=0"
"241","9.393963","128.3.255.34","224.0.1.22","SRVLOC","103","[Packet size limited during capture]"
"242","9.394207","128.3.255.34","224.0.1.22","SRVLOC","134","[Packet size limited during capture]"
"243","9.457918","193.116.32.109","131.243.155.250","TCP","1514","http > rmiregistry [ACK] Seq=7301 Ack=1286 Win=64240 Len=1460"
"244","9.458167","193.116.32.109","131.243.155.250","TCP","1514","http > rmiregistry [ACK] Seq=8761 Ack=1286 Win=64240 Len=1460"
"245","9.458292","193.116.32.109","131.243.155.250","TCP","1514","http > rmiregistry [PSH, ACK] Seq=10221 Ack=1286 Win=64240 Len=1460"
"246","9.461968","131.243.155.250","193.116.32.109","TCP","60","rmiregistry > http [ACK] Seq=1286 Ack=8761 Win=8760 Len=0"
"247","9.461980","131.243.155.250","193.116.32.109","TCP","60","rmiregistry > http [ACK] Seq=1286 Ack=11681 Win=8760 Len=0"
"248","9.484582","131.243.155.227","128.3.161.22","UDP","89","Source port: snmp  Destination port: 1032[Packet size limited during capture]"
"249","9.549611","193.116.32.109","131.243.155.250","TCP","1514","http > rmiregistry [ACK] Seq=11681 Ack=1286 Win=64240 Len=1460"
"250","9.549860","193.116.32.109","131.243.155.250","TCP","1514","http > rmiregistry [ACK] Seq=13141 Ack=1286 Win=64240 Len=1460"
"251","9.549985","193.116.32.109","131.243.155.250","TCP","1514","http > rmiregistry [PSH, ACK] Seq=14601 Ack=1286 Win=64240 Len=1460"
"252","9.550111","193.116.32.109","131.243.155.250","TCP","1514","http > rmiregistry [ACK] Seq=16061 Ack=1286 Win=64240 Len=1460"
"253","9.550236","193.116.32.109","131.243.155.250","TCP","1514","http > rmiregistry [ACK] Seq=17521 Ack=1286 Win=64240 Len=1460"
"254","9.550361","193.116.32.109","131.243.155.250","TCP","1266","http > rmiregistry [PSH, ACK] Seq=18981 Ack=1286 Win=64240 Len=1212"
"255","9.555408","131.243.155.174","131.243.155.255","NBDS","243","[Packet size limited during capture]"
"256","9.555782","44:39:9e:a2:df:23","Broadcast","IPX","232","[Packet size limited during capture]"
"257","9.557482","128.3.161.22","131.243.155.227","UDP","89","Source port: 1032  Destination port: snmp[Packet size limited during capture]"
"258","9.558406","131.243.155.250","193.116.32.109","TCP","60","rmiregistry > http [ACK] Seq=1286 Ack=14601 Win=8760 Len=0"
"259","9.558411","131.243.155.250","193.116.32.109","TCP","60","rmiregistry > http [ACK] Seq=1286 Ack=17521 Win=8760 Len=0"
"260","9.558417","131.243.155.250","193.116.32.109","TCP","60","rmiregistry > http [ACK] Seq=1286 Ack=20193 Win=8760 Len=0"
"261","9.620493","131.243.155.227","128.3.161.22","UDP","91","Source port: snmp  Destination port: 1032[Packet size limited during capture]"
"262","9.645927","193.116.32.109","131.243.155.250","TCP","1514","http > rmiregistry [ACK] Seq=20193 Ack=1286 Win=64240 Len=1460"
"263","9.646052","193.116.32.109","131.243.155.250","TCP","1514","http > rmiregistry [ACK] Seq=21653 Ack=1286 Win=64240 Len=1460"
"264","9.646177","193.116.32.109","131.243.155.250","TCP","1514","http > rmiregistry [ACK] Seq=23113 Ack=1286 Win=64240 Len=1460"
"265","9.646302","193.116.32.109","131.243.155.250","TCP","1514","http > rmiregistry [ACK] Seq=24573 Ack=1286 Win=64240 Len=1460"
"266","9.646427","193.116.32.109","131.243.155.250","TCP","1514","http > rmiregistry [ACK] Seq=26033 Ack=1286 Win=64240 Len=1460"
"267","9.646552","193.116.32.109","131.243.155.250","TCP","1514","[TCP Window Full] http > rmiregistry [PSH, ACK] Seq=27493 Ack=1286 Win=64240 Len=1460"
"268","9.649849","131.243.155.250","193.116.32.109","TCP","60","rmiregistry > http [ACK] Seq=1286 Ack=23113 Win=8760 Len=0"
"269","9.652348","131.243.155.250","193.116.32.109","TCP","60","rmiregistry > http [ACK] Seq=1286 Ack=26033 Win=8760 Len=0"
"270","9.653728","131.243.155.250","193.116.32.109","TCP","60","rmiregistry > http [ACK] Seq=1286 Ack=28953 Win=8760 Len=0"
"271","9.653801","128.3.161.22","131.243.155.227","UDP","185","Source port: 1032  Destination port: snmp[Packet size limited during capture]"
"272","9.677158","128.3.209.68","239.255.255.253","SRVLOC","91","[Packet size limited during capture]"
"273","9.713061","131.243.155.250","218.131.115.53","TCP","1149","danf-ak2 > http [PSH, ACK] Seq=1 Ack=1 Win=7525 Len=1095"
"274","9.716761","218.131.115.53","131.243.155.250","TCP","1514","http > danf-ak2 [ACK] Seq=1 Ack=1096 Win=33843 Len=1460"
"275","9.716890","218.131.115.53","131.243.155.250","TCP","1514","http > danf-ak2 [ACK] Seq=1461 Ack=1096 Win=33843 Len=1460"
"276","9.717136","218.131.115.53","131.243.155.250","TCP","1514","http > danf-ak2 [ACK] Seq=2921 Ack=1096 Win=33843 Len=1460"
"277","9.720688","131.243.155.250","218.131.115.53","TCP","60","danf-ak2 > http [ACK] Seq=1096 Ack=2921 Win=8760 Len=0"
"278","9.723381","218.131.115.53","131.243.155.250","TCP","1514","http > danf-ak2 [PSH, ACK] Seq=4381 Ack=1096 Win=33843 Len=1460"
"279","9.723506","218.131.115.53","131.243.155.250","TCP","1514","http > danf-ak2 [ACK] Seq=5841 Ack=1096 Win=33843 Len=1460"
"280","9.723630","218.131.115.53","131.243.155.250","TCP","1514","http > danf-ak2 [ACK] Seq=7301 Ack=1096 Win=33843 Len=1460"
"281","9.727427","131.243.155.250","218.131.115.53","TCP","60","danf-ak2 > http [ACK] Seq=1096 Ack=5841 Win=8760 Len=0"
"282","9.727432","131.243.155.250","218.131.115.53","TCP","60","danf-ak2 > http [ACK] Seq=1096 Ack=8761 Win=8760 Len=0"
"283","9.729752","218.131.115.53","131.243.155.250","TCP","645","[TCP Previous segment not captured] http > danf-ak2 [PSH, ACK] Seq=11681 Ack=1096 Win=33843 Len=591"
"284","9.730125","218.131.115.53","131.243.155.250","TCP","1514","[TCP Out-Of-Order] http > danf-ak2 [ACK] Seq=8761 Ack=1096 Win=33843 Len=1460"
"285","9.730251","218.131.115.53","131.243.155.250","TCP","1514","[TCP Out-Of-Order] http > danf-ak2 [PSH, ACK] Seq=10221 Ack=1096 Win=33843 Len=1460"
"286","9.731800","131.243.155.250","218.131.115.53","TCP","66","[TCP Dup ACK 282#1] danf-ak2 > http [ACK] Seq=1096 Ack=8761 Win=8760 Len=0 SLE=11681 SRE=12272"
"287","9.733177","131.243.155.250","218.131.115.53","TCP","60","danf-ak2 > http [ACK] Seq=1096 Ack=12272 Win=8760 Len=0"
"288","9.737247","193.116.32.109","131.243.155.250","TCP","1514","http > rmiregistry [ACK] Seq=28953 Ack=1286 Win=64240 Len=1460"
"289","9.737372","193.116.32.109","131.243.155.250","TCP","1514","http > rmiregistry [PSH, ACK] Seq=30413 Ack=1286 Win=64240 Len=1460"
"290","9.739999","193.116.32.109","131.243.155.250","TCP","1514","http > rmiregistry [ACK] Seq=31873 Ack=1286 Win=64240 Len=1460"
"291","9.740051","131.243.155.250","193.116.32.109","TCP","60","rmiregistry > http [ACK] Seq=1286 Ack=31873 Win=8760 Len=0"
"292","9.740123","193.116.32.109","131.243.155.250","TCP","1514","http > rmiregistry [PSH, ACK] Seq=33333 Ack=1286 Win=64240 Len=1460"
"293","9.741244","193.116.32.109","131.243.155.250","TCP","1514","http > rmiregistry [ACK] Seq=34793 Ack=1286 Win=64240 Len=1460"
"294","9.741369","193.116.32.109","131.243.155.250","TCP","1514","http > rmiregistry [PSH, ACK] Seq=36253 Ack=1286 Win=64240 Len=1460"
"295","9.747789","131.243.155.250","193.116.32.109","TCP","60","rmiregistry > http [ACK] Seq=1286 Ack=37713 Win=8760 Len=0"
"296","9.763156","131.243.155.83","131.243.141.187","ICMP","98","Echo (ping) request  id=0x0200, seq=59911/2026, ttl=32 (reply in 297)"
"297","9.763856","131.243.141.187","131.243.155.83","ICMP","98","Echo (ping) reply    id=0x0200, seq=59911/2026, ttl=127 (request in 296)"
"298","9.764280","131.243.155.83","128.3.161.230","ICMP","98","Echo (ping) request  id=0x0200, seq=60167/2027, ttl=32 (reply in 299)"
"299","9.765985","128.3.161.230","131.243.155.83","ICMP","98","Echo (ping) reply    id=0x0200, seq=60167/2027, ttl=127 (request in 298)"
"300","9.766409","131.243.155.83","128.3.161.74","ICMP","98","Echo (ping) request  id=0x0200, seq=60423/2028, ttl=32 (reply in 301)"
"301","9.766853","128.3.161.74","131.243.155.83","ICMP","98","Echo (ping) reply    id=0x0200, seq=60423/2028, ttl=127 (request in 300)"
"302","9.767153","131.243.155.83","128.3.161.165","ICMP","98","Echo (ping) request  id=0x0200, seq=60679/2029, ttl=32 (reply in 303)"
"303","9.767478","128.3.161.165","131.243.155.83","ICMP","98","Echo (ping) reply    id=0x0200, seq=60679/2029, ttl=127 (request in 302)"
"304","9.767902","82:95:f4:2b:95:3d","Broadcast","IPX","60","[Packet size limited during capture]"
"305","9.768103","80:0b:98:3b:b9:ec","82:95:f4:2b:95:3d","IPX","60","[Packet size limited during capture]"
"306","9.768652","82:95:f4:2b:95:3d","Broadcast","IPX","60","[Packet size limited during capture]"
"307","9.768727","80:0b:98:3b:b9:ec","82:95:f4:2b:95:3d","IPX","60","[Packet size limited during capture]"
"308","9.769151","82:95:f4:2b:95:3d","Broadcast","IPX","60","[Packet size limited during capture]"
"309","9.769227","80:0b:98:3b:b9:ec","82:95:f4:2b:95:3d","IPX","60","[Packet size limited during capture]"
"310","9.799508","131.243.155.250","218.131.115.53","TCP","1147","danf-ak2 > http [PSH, ACK] Seq=1096 Ack=12272 Win=8760 Len=1093"
"311","9.799514","131.243.155.250","218.131.115.53","TCP","62","mctp > http [SYN] Seq=0 Win=8192 Len=0 MSS=1460 SACK_PERM=1"
"312","9.801832","218.131.115.53","131.243.155.250","TCP","62","http > mctp [SYN, ACK] Seq=0 Ack=1 Win=5840 Len=0 MSS=1460 SACK_PERM=1"
"313","9.802131","131.243.155.250","218.131.115.53","TCP","60","mctp > http [ACK] Seq=1 Ack=1 Win=8760 Len=0"
"314","9.802706","218.131.115.53","131.243.155.250","TCP","1079","http > danf-ak2 [PSH, ACK] Seq=12272 Ack=2189 Win=33843 Len=1025"
"315","9.803505","131.243.155.250","218.131.115.53","TCP","1205","mctp > http [PSH, ACK] Seq=1 Ack=1 Win=8760 Len=1151"
"316","9.805954","218.131.115.53","131.243.155.250","TCP","60","http > mctp [ACK] Seq=1 Ack=1152 Win=8057 Len=0"
"317","9.806455","218.131.115.53","131.243.155.250","TCP","215","http > mctp [PSH, ACK] Seq=1 Ack=1152 Win=8057 Len=161"
"318","9.827317","193.116.32.109","131.243.155.250","TCP","1514","http > rmiregistry [ACK] Seq=37713 Ack=1286 Win=64240 Len=1460"
"319","9.827442","193.116.32.109","131.243.155.250","TCP","1082","http > rmiregistry [PSH, ACK] Seq=39173 Ack=1286 Win=64240 Len=1028"
"320","9.830239","131.243.155.250","193.116.32.109","TCP","60","rmiregistry > http [ACK] Seq=1286 Ack=40201 Win=8760 Len=0"
"321","9.835062","193.116.32.109","131.243.155.250","TCP","1514","http > rmiregistry [ACK] Seq=40201 Ack=1286 Win=64240 Len=1460"
"322","9.835312","193.116.32.109","131.243.155.250","TCP","1514","http > rmiregistry [ACK] Seq=41661 Ack=1286 Win=64240 Len=1460"
"323","9.835562","193.116.32.109","131.243.155.250","TCP","1514","http > rmiregistry [ACK] Seq=43121 Ack=1286 Win=64240 Len=1460"
"324","9.835688","193.116.32.109","131.243.155.250","TCP","1514","http > rmiregistry [ACK] Seq=44581 Ack=1286 Win=64240 Len=1460"
"325","9.840360","131.243.155.250","193.116.32.109","TCP","60","rmiregistry > http [ACK] Seq=1286 Ack=43121 Win=8760 Len=0"
"326","9.840483","131.243.155.250","193.116.32.109","TCP","60","rmiregistry > http [ACK] Seq=1286 Ack=46041 Win=8760 Len=0"
"327","9.862345","131.243.155.250","218.131.115.53","TCP","1149","mctp > http [PSH, ACK] Seq=1152 Ack=162 Win=8599 Len=1095"
"328","9.863345","131.243.155.250","218.131.115.53","TCP","1190","danf-ak2 > http [PSH, ACK] Seq=2189 Ack=13297 Win=7735 Len=1136"
"329","9.865419","218.131.115.53","131.243.155.250","TCP","571","[TCP Previous segment not captured] http > mctp [PSH, ACK] Seq=3082 Ack=2247 Win=10359 Len=517"
"330","9.865919","218.131.115.53","131.243.155.250","TCP","1514","[TCP Out-Of-Order] http > mctp [ACK] Seq=162 Ack=2247 Win=10359 Len=1460"
"331","9.866043","218.131.115.53","131.243.155.250","TCP","1514","[TCP Out-Of-Order] http > mctp [ACK] Seq=1622 Ack=2247 Win=10359 Len=1460"
"332","9.866168","218.131.115.53","131.243.155.250","TCP","215","http > danf-ak2 [PSH, ACK] Seq=13297 Ack=3325 Win=33843 Len=161"
"333","9.866592","2e:9f:6e:9b:93:77","Broadcast","LLC","60","[Packet size limited during capture]"
"334","9.866717","2e:9f:6e:9b:93:77","Broadcast","LLC","60","[Packet size limited during capture]"
"335","9.866842","2e:9f:6e:9b:93:77","Broadcast","IPX","60","[Packet size limited during capture]"
"336","9.866970","2e:9f:6e:9b:93:77","Broadcast","LLC","60","[Packet size limited during capture]"
"337","9.868591","131.243.155.250","218.131.115.53","TCP","66","[TCP Dup ACK 327#1] mctp > http [ACK] Seq=2247 Ack=162 Win=8599 Len=0 SLE=3082 SRE=3599"
"338","9.868716","131.243.155.250","218.131.115.53","TCP","60","mctp > http [ACK] Seq=2247 Ack=3599 Win=8760 Len=0"
"339","9.876037","80:0b:98:3b:b9:ec","2e:9f:6e:9b:93:77","IPX","302","[Packet size limited during capture]"
"340","9.876586","131.243.155.250","193.116.32.109","TCP","62","pt2-discover > http [SYN] Seq=0 Win=8192 Len=0 MSS=1460 SACK_PERM=1"
"341","9.893651","131.243.140.151","224.0.1.22","SRVLOC","150","[Packet size limited during capture]"
"342","9.917762","193.116.32.109","131.243.155.250","TCP","1229","http > rmiregistry [PSH, ACK] Seq=46041 Ack=1286 Win=64240 Len=1175"
"343","9.933181","131.243.155.250","218.131.115.53","TCP","1152","mctp > http [PSH, ACK] Seq=2247 Ack=3599 Win=8760 Len=1098"
"344","9.936499","218.131.115.53","131.243.155.250","TCP","1147","[TCP Previous segment not captured] http > mctp [PSH, ACK] Seq=5059 Ack=3345 Win=12661 Len=1093"
